{
    "$schema": "https://json-schema.org/draft/2020-12/schema",
    "$id": "https://raw.githubusercontent.com/mromanello/DTS-validator/main/schemas/entry_response_schema.json",
    "type": "object",
    "properties": {
        "@context": {"type": "string"},
        "@id": {"type": "string"},
        "@type": {"type": "string"},
        "dtsVersion": {
            "type": "string",
            "enum": ["1-alpha"]
        },
        "collection": {"type": "string"},
        "document": {"type": "string"},
        "navigation": {"type": "string"}
    },
    "required": [
        "@context", "@id", "@type", "dtsVersion", "collection", "document", "navigation"
    ]
}
