{
    "@context": "https://distributed-text-services.github.io/specifications/context/1-alpha1.json",
    "dtsVersion": "1-alpha",
    "@id": "/dts/api/",
    "@type": "EntryPoint",
    "collection": "/dts/api/collection/{?id,page,nav}",
    "navigation" : "/dts/api/navigation/{?resource,ref,start,end,down,tree,page}",
    "document": "/dts/api/document/{?resource,ref,start,end,tree,mediaType}"
}